title,price,Bedrooms,square_feet,full_address,monthly,apartment,cats_allowed,dogs_allowed,laundry_on_site,air_conditioning,off_street_parking,EV_charging,washer_dryer_in_unit,carport,no_smoking,attached_garage,detached_garage,laundry_in_bldg,fee_needed_to_apply,wheelchair_accessible,no_parking,furnished,street_parking,no_laundry_on_site,house,washer_dryer_hookups,date_added,latitude,longitude,nearest_budget_grocery_store_distance,nearest_budget_grocery_store,nearest_midTier_grocery_store_distance,nearest_midTier_grocery_store,nearest_premium_grocery_store_distance,nearest_premium_grocery_store
1 Bedroom 1 Bath in West Los Angeles + Air Conditioning + Parking,2650.0,1br,850.0,"1810 South Bentley Avenue, West Los Angeles, CA 91423",1,1,1,1,1,1,1,0,0,0,0,0,0,0,0,0,0,0,0,0,0,0,2024-05-31,34.0463984,-118.4415696,0.711583087284514,"Smart & Final Extra! - 11221 W Pico Blvd, Los Angeles",0.9019415283978094,"Ralphs Fresh Fare - 11727 W Olympic Blvd, Los Angeles",0.4923092197729521,"Bristol Farms - 1515 Westwood Blvd, Los Angeles"
SS Appliances + 1 Bedroom 1 BA in West Los Angeles + Fully Renovated,2599.0,1br,750.0,"1342 Wellesley Avenue, West Los Angeles, CA 90025",1,1,0,1,1,1,1,0,0,0,0,0,0,0,0,0,0,0,0,0,0,0,2024-05-31,34.0407878,-118.4664544,0.1355387993058303,"Smart & Final - 12210 Santa Monica Blvd W, Los Angeles",0.2911233743461746,"Ralphs Fresh Fare - 12057 Wilshire Blvd, Los Angeles",0.3659035547893379,"Bristol Farms - 3105 Wilshire Blvd, Santa Monica"
"Westwood 1 Bedroom 1 Bath, Perfect for Students of UCLA, $500 Off!",2785.0,1br,1000.0,"433 Kelton Avenue, Los Angeles, CA 90024",1,1,0,0,0,1,1,1,0,0,0,0,0,1,0,0,0,0,0,0,0,0,2024-05-31,34.0692909,-118.4539407,2.123608524739189,"Smart & Final - 12210 Santa Monica Blvd W, Los Angeles",0.7413462338175659,"Ralphs Fresh Fare - 10861 Weyburn Ave, Los Angeles",0.6888189758484459,"Whole Foods Market - 1050 Gayley Ave, Los Angeles"
Westwood Village 1 Bedroom Suite + Furnished + Great Value!,4125.0,1br,650.0,"1033 Hilgard Avenue, Los Angeles, CA 90024",1,1,1,1,0,1,1,0,0,0,0,0,0,1,0,0,0,1,0,0,0,0,2024-05-31,34.0607194,-118.4422418,1.6848822479804286,"Smart & Final Extra! - 11221 W Pico Blvd, Los Angeles",0.1384412490095186,"Trader Joe's - 1000 Glendon Ave, Los Angeles",0.2703436078232251,"Whole Foods Market - 1050 Gayley Ave, Los Angeles"
"Community Grills, Breakfast Bar, On-site Laundry Facility, Dishwasher",2235.0,1br,797.0,"3516 Sawtelle, Los Angeles, CA 90066",1,1,1,1,0,1,0,0,0,1,0,0,0,1,0,0,0,0,0,0,0,0,2024-05-31,34.0165601,-118.4233841,1.6085088103420695,"Smart & Final Extra! - 11221 W Pico Blvd, Los Angeles",0.8684957259971924,"Ralphs - 11361 National Blvd, Los Angeles",0.9299153995882328,"Whole Foods Market - 11666 National Blvd, Los Angeles"
"Beautiful Courtyard, Air Conditioning, Spacious Floor Plans",3250.0,1br,693.0,"11701 Gateway Blvd., Los Angeles, CA 90064",1,1,1,1,0,1,0,1,1,0,0,1,0,0,0,1,0,0,0,0,0,0,2024-05-31,34.02849399999999,-118.443677,0.6616733869179222,"Smart & Final Extra! - 11221 W Pico Blvd, Los Angeles",0.4793340312459953,"Trader Joe's - 11755 W Olympic Blvd, Los Angeles",0.5284057971493725,"Whole Foods Market - 11666 National Blvd, Los Angeles"
"Package Receiving, Cable Ready, Swimming Pool & Spa",2548.0,1br,850.0,"3420 Sepulveda Blvd, Los Angeles, CA 90034",1,1,0,0,1,1,1,1,0,0,0,0,0,0,0,0,0,0,0,0,0,0,2024-05-31,34.0209372,-118.4228364,1.3753673968037623,"Smart & Final Extra! - 11221 W Pico Blvd, Los Angeles",0.6966364618523346,"Ralphs - 11361 National Blvd, Los Angeles",0.8727429765159235,"Whole Foods Market - 11666 National Blvd, Los Angeles"
"Emergency Maintenance, Hardwood-Inspired Floors, 1/bd 1/ba",2471.0,1br,382.0,"1447 Lincoln Blvd, Santa Monica, CA 90401",1,1,1,0,1,1,0,1,0,0,0,1,0,0,0,0,0,0,0,0,0,0,2024-05-31,34.0183996,-118.4898922,1.915444945193366,"Smart & Final Extra! - 604 Lincoln Blvd, Venice",0.2396949173789324,"Trader Joe's - 500 Broadway, Santa Monica",1.033751538368923,"Whole Foods Market - 1425 Montana Ave, Santa Monica"
"Great Location, Laundry Facility, Fireplace*, Wood-Style Flooring",2402.0,1br,664.0,"1920 Sawtelle Ave, Los Angeles, CA 90025",1,1,1,1,0,1,0,1,0,0,0,1,0,1,0,0,0,0,0,0,0,0,2024-05-31,34.0422605,-118.4444631,0.5525237502951821,"Smart & Final Extra! - 11221 W Pico Blvd, Los Angeles",0.5717313158220909,"Ralphs Fresh Fare - 11727 W Olympic Blvd, Los Angeles",0.8061002753658811,"Bristol Farms - 1515 Westwood Blvd, Los Angeles"
Remodeled 1 Bedroom in Marina Del Rey | Balcony | Full Kitchen | A/C,2695.0,1br,750.0,"415 Washington Boulevard, Venice, CA 90292",1,1,1,0,1,1,1,0,0,0,0,0,0,0,0,0,0,0,0,0,0,0,2024-05-31,33.9814954,-118.4631172,1.168258464330857,"Costco Loading Dock - 13463 Washington Blvd, Marina Del Rey",1.155450704280247,"Ralphs Fresh Fare - 4311 Lincoln Blvd, Marina Del Rey",0.5699740395339166,"Erewhon - 585 Venice Blvd., Venice"
Remodeled 1+1 in West Los Angeles**SPECIALS**Parking**Quartz Counters,2250.0,1br,700.0,"4111 Mclaughlin Avenue, Los Angeles, CA 90066",1,1,1,0,1,0,1,0,0,0,0,0,0,0,0,0,0,0,0,0,0,0,2024-05-31,34.0021072,-118.4198936,1.6515665294705808,"Costco Wholesale - 13463 Washington Blvd, Marina Del Rey",1.8188557912583023,"Ralphs Fresh Fare - 4311 Lincoln Blvd, Marina Del Rey",1.7476155245782714,"Whole Foods Market - 11666 National Blvd, Los Angeles"
WEST LOS ANGELES 1 Bedroom 1 Bath + Fitness Center + Swimming Pool,2408.0,1br,650.0,"3230 Overland Avenue, Culver City, CA 90034",1,1,0,0,1,1,1,0,0,0,0,0,0,0,0,0,0,0,0,0,0,0,2024-05-31,34.0291156,-118.4141723,1.438614253363398,"Smart & Final Extra! - 11221 W Pico Blvd, Los Angeles",1.1161827996168483,"Ralphs - 11361 National Blvd, Los Angeles",1.4370715044658868,"Whole Foods Market - 11666 National Blvd, Los Angeles"
"Solar Photovoltaic System, Central A/C and heat., 1/BD",4095.0,1br,801.0,"210 Santa Monica Blvd, Santa Monica, CA 90401",1,1,1,1,0,1,0,1,1,0,1,0,0,0,0,0,1,0,0,0,0,0,2024-05-31,34.0148949,-118.4965919,2.099804750655249,"Smart & Final Extra! - 604 Lincoln Blvd, Venice",0.28386043758032,"Trader Joe's - 500 Broadway, Santa Monica",1.244720372955476,"Whole Foods Market - 1425 Montana Ave, Santa Monica"
1 Bed / 1 Bath. Convenient in-home washer and dryer included.,3255.0,1br,516.0,"3644 Overland Ave, Los Angeles, CA 90034",1,1,1,1,0,1,0,1,1,1,1,0,0,0,1,1,0,0,0,0,0,0,2024-05-31,34.02226640000001,-118.4093348,1.898844591291373,"Smart & Final Extra! - 11221 W Pico Blvd, Los Angeles",1.3979296779817754,"Ralphs - 11361 National Blvd, Los Angeles",1.6393680212492403,"Whole Foods Market - 11666 National Blvd, Los Angeles"
Pet friendly community in Los Angeles. 1 BD / 1 BA. Call for tour!,3275.0,1br,579.0,"3644 Overland Ave, Los Angeles, CA 90034",1,1,1,1,0,1,0,1,1,1,1,0,0,0,1,1,0,0,0,0,0,0,2024-05-31,34.02226640000001,-118.4093348,1.898844591291373,"Smart & Final Extra! - 11221 W Pico Blvd, Los Angeles",1.3979296779817754,"Ralphs - 11361 National Blvd, Los Angeles",1.6393680212492403,"Whole Foods Market - 11666 National Blvd, Los Angeles"
Simply breath-taking! Amazing views at The Roy,3190.0,1br,544.0,"3644 Overland Ave, Los Angeles, CA 90034",1,1,1,1,0,1,0,1,1,1,1,0,0,0,1,1,0,0,0,0,0,0,2024-05-31,34.02226640000001,-118.4093348,1.898844591291373,"Smart & Final Extra! - 11221 W Pico Blvd, Los Angeles",1.3979296779817754,"Ralphs - 11361 National Blvd, Los Angeles",1.6393680212492403,"Whole Foods Market - 11666 National Blvd, Los Angeles"
"Smoke Free, Laundry Facility, Cable Ready, Vaulted Ceiling",2677.0,1br,767.0,"535 Gayley Avenue, Westwood, CA 90024",1,1,1,1,0,1,0,1,0,0,0,1,0,1,0,0,0,0,0,0,0,0,2024-05-31,34.0692142,-118.4507019,2.1782263042537378,"Smart & Final - 12210 Santa Monica Blvd W, Los Angeles",0.598282292539239,"Ralphs Fresh Fare - 10861 Weyburn Ave, Los Angeles",0.5951260875562286,"Whole Foods Market - 1050 Gayley Ave, Los Angeles"
"Private Balconies, Elfa Closet System",2471.0,1br,382.0,"1447 Lincoln Blvd, Santa Monica, CA 90401",1,1,1,0,1,1,0,1,0,0,0,1,0,0,0,0,0,0,0,0,0,0,2024-05-31,34.0183996,-118.4898922,1.915444945193366,"Smart & Final Extra! - 604 Lincoln Blvd, Venice",0.2396949173789324,"Trader Joe's - 500 Broadway, Santa Monica",1.033751538368923,"Whole Foods Market - 1425 Montana Ave, Santa Monica"
"Gorgeous new construction! Get yourself a brand new 1 bed, 1 bath!",3525.0,1br,631.0,"3630 Overland Ave, Los Angeles, CA 90034",1,1,1,1,0,1,1,1,1,0,0,0,0,0,1,1,0,0,0,0,0,0,2024-05-31,34.02276390000001,-118.4095784,1.869103946656898,"Smart & Final Extra! - 11221 W Pico Blvd, Los Angeles",1.3781279930386157,"Ralphs - 11361 National Blvd, Los Angeles",1.625450064234588,"Whole Foods Market - 11666 National Blvd, Los Angeles"
Feel refreshed in our resort style swimming pool! 1 BD / 1 BA!,3145.0,1br,525.0,"3644 Overland Ave, Los Angeles, CA 90034",1,1,1,1,1,1,0,1,0,1,1,0,0,0,1,1,0,0,0,0,0,0,2024-05-31,34.02226640000001,-118.4093348,1.898844591291373,"Smart & Final Extra! - 11221 W Pico Blvd, Los Angeles",1.3979296779817754,"Ralphs - 11361 National Blvd, Los Angeles",1.6393680212492403,"Whole Foods Market - 11666 National Blvd, Los Angeles"
"Natural Gas Range/Oven, Central HVAC, Laundry Room, Disposal",2231.0,1br,647.0,"12427 W Jefferson Blvd, Los Angeles, CA 90066",1,1,1,1,1,1,0,0,0,0,1,1,0,0,0,0,0,0,0,0,0,0,2024-05-31,33.981011,-118.410259,2.2249868086124787,"Costco Wholesale - 13463 Washington Blvd, Marina Del Rey",1.647324361888129,"Ralphs Fresh Fare - 4700 Admiralty Way, Marina Del Rey",3.029643835951993,"Erewhon - 585 Venice Blvd., Venice"
"Lofts*, Assigned Parking, Breakfast Bar*, Fully Equipped Kitchens",2402.0,1br,664.0,"1920 Sawtelle Ave, Los Angeles, CA 90025",1,1,1,1,0,1,0,1,0,0,0,1,0,1,0,0,0,0,0,0,0,0,2024-05-31,34.0422605,-118.4444631,0.5525237502951821,"Smart & Final Extra! - 11221 W Pico Blvd, Los Angeles",0.5717313158220909,"Ralphs Fresh Fare - 11727 W Olympic Blvd, Los Angeles",0.8061002753658811,"Bristol Farms - 1515 Westwood Blvd, Los Angeles"
"Resort-style heated pool, Mirrored oversized closets, Balcony or patio",2706.0,1br,634.0,"233 South Barrington Avenue, Los Angeles, CA 90049",1,1,1,1,1,0,0,0,0,1,0,0,0,0,0,0,0,0,0,0,0,0,2024-05-31,34.0638641,-118.4692654,1.6855062011842188,"Smart & Final - 12210 Santa Monica Blvd W, Los Angeles",1.3114778956195163,"Ralphs Fresh Fare - 12057 Wilshire Blvd, Los Angeles",0.7156669290325806,"Whole Foods Market - 11737 San Vicente Blvd, Los Angeles"
"Private Balconies, Elevator Access, Controlled Access",2471.0,1br,382.0,"1447 Lincoln Blvd, Santa Monica, CA 90401",1,1,1,0,1,1,0,1,0,0,0,1,0,0,0,0,0,0,0,0,0,0,2024-05-31,34.0183996,-118.4898922,1.915444945193366,"Smart & Final Extra! - 604 Lincoln Blvd, Venice",0.2396949173789324,"Trader Joe's - 500 Broadway, Santa Monica",1.033751538368923,"Whole Foods Market - 1425 Montana Ave, Santa Monica"
"24-Hour cardio fitness center, Ceiling fan in the dining area",3247.0,1br,774.0,"233 South Barrington Avenue, Los Angeles, CA 90049",1,1,1,1,1,0,0,0,0,1,0,0,0,0,0,0,0,0,0,0,0,0,2024-05-31,34.0638641,-118.4692654,1.6855062011842188,"Smart & Final - 12210 Santa Monica Blvd W, Los Angeles",1.3114778956195163,"Ralphs Fresh Fare - 12057 Wilshire Blvd, Los Angeles",0.7156669290325806,"Whole Foods Market - 11737 San Vicente Blvd, Los Angeles"
